{
  "$schema": "https://json-schema.org/draft/2020-12/schema",
  "$id": "https://jonaminz.com/schema/jonaminz.contract.schema.v1.json",
  "title": "Jonaminz Contract v1",
  "description": "jonaminz.contract.json 的結構驗證。對應規格 docs/platform-integration-spec-v1.md（Frozen, S1-S39）。此 schema 只驗證單一文件的『結構是否合法』；以下留給 Worker 端 ingestion validator，不是這份 schema 檔案能表達的：S12 fail-soft（單一 entry/object 壞掉時剔除該項、其餘照收——JSON Schema 對整份文件只能給 valid/invalid 兩種結果）；S15 同源檢查（需要跑時查 Integration Settings 才知道登記網域）；cross-field 一致性（capabilities.requires[].entryId 是否真的對應到某個 entries[].entryId；requests/requires 的能力是否也出現在 supports 裡——後者是設計上合理的隱含不變式，但『陣列 A 的每個元素都在陣列 B 裡』不是 portable JSON Schema 能表達的關係，需要 $data 或程式邏輯才能查）。",
  "type": "object",
  "required": ["contractVersion", "app"],
  "additionalProperties": true,
  "not": { "$ref": "#/$defs/forbiddenFieldsGuard" },
  "properties": {
    "contractVersion": {
      "description": "S8：合約 schema 版本，整數，v1 = 1。與 SDK release / capability 版本 / Settings schema 版本是各自獨立的版本維度（Spec『版本維度用語』節）。",
      "const": 1
    },
    "app": {
      "description": "S1, S8：專案身份與自我描述。",
      "type": "object",
      "required": ["projectId", "title"],
      "additionalProperties": true,
      "not": { "$ref": "#/$defs/forbiddenFieldsGuard" },
      "properties": {
        "projectId": {
          "description": "S1：永久不可變、不可重用、與網域/repo/URL 無關。小寫英數與連字號、字母開頭、2-63 字元。",
          "type": "string",
          "pattern": "^[a-z][a-z0-9-]{1,62}$"
        },
        "title": {
          "description": "S8：顯示名稱，可自由改（不受 S1 的不可變限制，那條只管 projectId 本身）。",
          "type": "string",
          "minLength": 1,
          "maxLength": 200
        },
        "description": {
          "description": "S9：自我描述類欄位允許（icon/title 可以，排序類不行）。",
          "type": "string",
          "maxLength": 2000
        },
        "icon": {
          "description": "S9, S15：icon 允許自我宣告；若為 URL 需符合 S15 的 URL 欄位規則（見 $defs/contractUrl）。",
          "$ref": "#/$defs/contractUrl"
        }
      }
    },
    "shell": {
      "description": "敘事骨架：合約可宣告 shell:false，此時只建 Platform API、不做任何 UI。省略時預設視為 true（由 SDK 認定，不是本 schema 的職責）。",
      "type": "boolean"
    },
    "css": {
      "description": "S34, 第五部分, S11：CSS 生效等級聲明。v1 Worker 只認得 none/tokens 兩個值；components/full/self 屬保留層。刻意不用 enum 鎖死允許值——S11 規定『未知 enum 值視為不支援，不得整份判失敗』，用 enum 會讓未來出現 components 時整份合約直接 invalid，牴觸 must-ignore 原則。這裡只做語法層防呆（小寫字母開頭、允許連字號），值的語意判讀（認得/不認得）是 Worker 的事。",
      "type": "string",
      "pattern": "^[a-z][a-z-]{0,49}$"
    },
    "entries": {
      "description": "S3, S7-S12：本專案對外暴露的整合入口清單（例如某個可被連結/嵌入的頁面或功能單元）。",
      "type": "array",
      "maxItems": 200,
      "items": { "$ref": "#/$defs/entry" }
    },
    "objects": {
      "description": "S2-S5：本專案宣告支援的 object type 清單。宣告存在 ≠ 資料可被平台讀取；實際讀寫由未來 capability 定義（S5）。objectId 由專案自己生成、對平台不透明，不在合約裡列舉實際 object 實例。",
      "type": "array",
      "maxItems": 100,
      "items": { "$ref": "#/$defs/objectTypeDeclaration" }
    },
    "capabilities": {
      "description": "S10, S30：能力宣告，三分 supports/requests/requires。設計不變式（Worker 端檢查，非本 schema）：requests 與 requires[].capability 出現的每個能力，理論上也該出現在 supports 裡——沒有宣告 supports 卻 requests/requires，語意上是自相矛盾（怎麼會需要一個自己不支援的能力）。",
      "type": "object",
      "additionalProperties": true,
      "not": { "$ref": "#/$defs/forbiddenFieldsGuard" },
      "properties": {
        "supports": {
          "description": "S10：能整合的能力，平台可自由選擇是否啟用。是 requests/requires 的能力全集（Worker 端不變式，見上）。",
          "type": "array",
          "maxItems": 200,
          "items": { "$ref": "#/$defs/capabilityId" },
          "uniqueItems": true
        },
        "requests": {
          "description": "S10：希望啟用的能力，缺了可降級（不影響宿主頁面運作）。",
          "type": "array",
          "maxItems": 200,
          "items": { "$ref": "#/$defs/capabilityId" },
          "uniqueItems": true
        },
        "requires": {
          "description": "S10：綁定某 entry 或整合單元的能力，缺它該單元不啟用。requires 永不阻止宿主頁面運作、永不造成自動 grant（S10, S16）。uniqueItems 只能擋完全相同的 {capability, entryId} 物件重複；『同 capability+entryId 但夾帶不同未知欄位』這種語意重複，仍要靠 Worker ingestion 查。",
          "type": "array",
          "maxItems": 200,
          "items": { "$ref": "#/$defs/capabilityRequirement" },
          "uniqueItems": true
        }
      }
    }
  },
  "$defs": {
    "forbiddenFieldsGuard": {
      "description": "S9：合約永不含的欄位名清單，套用在頂層與每個已知的巢狀物件（app / entry / objects[] 項目 / capabilities / capabilities.requires[] 項目）。即使出現也依 S16 無授權效力，這裡是防呆，讓合約作者及早發現寫錯，而不是靜默放行。演進層（見規格第三部分）新增的物件結構若未來加入本 schema，也要一併掛上這個 guard。",
      "anyOf": [
        { "type": "object", "required": ["enabled"] },
        { "type": "object", "required": ["visibility"] },
        { "type": "object", "required": ["placement"] },
        { "type": "object", "required": ["order"] },
        { "type": "object", "required": ["weight"] },
        { "type": "object", "required": ["position"] },
        { "type": "object", "required": ["permissions"] },
        { "type": "object", "required": ["grantedCapabilities"] },
        { "type": "object", "required": ["secret"] },
        { "type": "object", "required": ["apiKey"] },
        { "type": "object", "required": ["token"] }
      ]
    },
    "id": {
      "description": "S1, S3：projectId/entryId/objectType 共用文法。",
      "type": "string",
      "pattern": "^[a-z][a-z0-9-]{1,62}$"
    },
    "capabilityId": {
      "description": "S30：<service>.<capability>@<major> 文法。service/capability 限小寫字母數字連字號（kebab-case），不允許 camelCase——保留服務名單（S30 附錄，如 sharedCache）本身就是『reserved roadmap，非 frozen API，發布前可改名』，統一成 kebab-case 是這份 schema 定案前最後一次免費改名機會，發布後才會被 S11『已發布欄位永不改語意與型別』鎖住。major 為正整數。",
      "type": "string",
      "pattern": "^[a-z][a-z0-9]*(-[a-z0-9]+)*\\.[a-z][a-z0-9]*(-[a-z0-9]+)*@[1-9][0-9]*$"
    },
    "contractUrl": {
      "description": "S15：合約中所有具導航/載入/server-side fetch 意義的 URL，必須是 https: 或相對 URL；同源限制由 Worker 依登記網域檢查，非本 schema 能表達。這裡刻意只接受 https:// 開頭或單一 / 開頭（path-absolute）兩種形式，明確排除 protocol-relative（// 開頭，會被瀏覽器解析成任意網域的 https:）；也刻意不放寬到『不帶開頭斜線的相對路徑』（如 assets/icon.png），因為 bare 相對路徑與 scheme:opaque 形式的 URL（如 javascript:...、data:...）在字串層難以可靠區分，屬已知的 URL 驗證陷阱，寧可比 RFC 3986 的『相對 URL』定義更保守。**額外排除任何反斜線**：WHATWG URL parser 對 http/https 等 special scheme 會把 `\\` 正規化成 `/`，導致 `/\\evil.example/a` 這種『看起來是 path-absolute』的字串實際解析出來變成 `https://evil.example/a`（已用 Node 的 URL() 實測驗證，等同 protocol-relative 的變形繞過）；純靠正斜線比對擋不住這個，所以整個 pattern 一律禁止出現反斜線字元。",
      "type": "string",
      "pattern": "^(https://[^\\s\\\\]+|/(?![/\\\\])[^\\s\\\\]*)$",
      "maxLength": 2048
    },
    "entry": {
      "type": "object",
      "required": ["entryId", "title", "url"],
      "additionalProperties": true,
      "not": { "$ref": "#/$defs/forbiddenFieldsGuard" },
      "properties": {
        "entryId": {
          "description": "S3：在 projectId 命名空間內永久穩定；語意永不改，要改就出新 ID。",
          "$ref": "#/$defs/id"
        },
        "title": {
          "type": "string",
          "minLength": 1,
          "maxLength": 200
        },
        "description": {
          "type": "string",
          "maxLength": 2000
        },
        "url": {
          "description": "S15：入口 URL。",
          "$ref": "#/$defs/contractUrl"
        },
        "icon": {
          "$ref": "#/$defs/contractUrl"
        },
        "deprecated": {
          "description": "S11：停用靠 deprecated 標記，永不刪除整個 entry 定義。",
          "type": "boolean",
          "default": false
        }
      }
    },
    "objectTypeDeclaration": {
      "type": "object",
      "required": ["objectType"],
      "additionalProperties": true,
      "not": { "$ref": "#/$defs/forbiddenFieldsGuard" },
      "properties": {
        "objectType": {
          "description": "S3：語意永不改，要改就出新 objectType。",
          "$ref": "#/$defs/id"
        },
        "description": {
          "type": "string",
          "maxLength": 2000
        },
        "deprecated": {
          "type": "boolean",
          "default": false
        }
      }
    },
    "capabilityRequirement": {
      "description": "S10：requires 必須明確綁定一個 entry（v1 定案：entryId 必填，避免『沒填到底是指整個合約、還是漏填』的模糊狀態）。未來若真的需要整份合約層級的 requires，屆時再新增明確的 scope 欄位，v1 不預先做。",
      "type": "object",
      "required": ["capability", "entryId"],
      "additionalProperties": true,
      "not": { "$ref": "#/$defs/forbiddenFieldsGuard" },
      "properties": {
        "capability": {
          "$ref": "#/$defs/capabilityId"
        },
        "entryId": {
          "description": "須對應 entries[].entryId。跨欄位參照一致性由 Worker ingestion 檢查，非本 schema 職責。",
          "$ref": "#/$defs/id"
        }
      }
    }
  }
}
